Palabra,Categoria,Traduccion,Idioma,Conjugaciones,Estado
nchiatrari,Verbo,gelare,Italiano,"nchiatru, nchiatras, nchiatra, nchiatramu, nchiatrati, nchiatranu, nchiatrai, nchiatrasti, nchiatrau, nchiatràmuru, nchiatràstivu, nchiatràranu",OK
nchicari,Verbo,"plegar, doblar",Español,"nchicu, nchicas, nchica, nchicamu, nchicati, nchicanu, nchicai, nchicasti, nchicau, nchicàmuru, nchicàstivu, nchicàranu",OK
nchimiddiari,Verbo,maneggiare,Italiano,"nchimiddiu, nchimiddias, nchimiddia, nchimiddiamu, nchimiddiati, nchimiddianu, nchimiddiai, nchimiddiasti, nchimiddiau, nchimiddiàmuru, nchimiddiàstivu, nchimiddiàranu",OK
nchiucchiulari,Verbo,"sedurre, attirare alle proprie voglie",Italiano,"nchiucchiulu, nchiucchiulas, nchiucchiula, nchiucchiulamu, nchiucchiulati, nchiucchiulanu, nchiucchiulai, nchiucchiulasti, nchiucchiulau, nchiucchiulàmuru, nchiucchiulàstivu, nchiucchiulàranu",OK
nchiuvari,Verbo,"clavar, fixar con clavos",Español,"nchiuvu, nchiuvas, nchiuva, nchiuvamu, nchiuvati, nchiuvanu, nchiuvai, nchiuvasti, nchiuvau, nchiuvàmuru, nchiuvàstivu, nchiuvàranu",OK
nciacari,Verbo,fare l'acciottolato,Italiano,"nciacu, nciacas, nciaca, nciacamu, nciacati, nciacanu, nciacai, nciacasti, nciacau, nciacàmuru, nciacàstivu, nciacàranu",OK
nciarrari,Verbo,acchiappare,Italiano,"nciarru, nciarras, nciarra, nciarramu, nciarrati, nciarranu, nciarrai, nciarrasti, nciarrau, nciarràmuru, nciarràstivu, nciarràranu",OK
ncicirari,Verbo,metter le gemme (detto delle piante),Italiano,"nciciru, nciciras, ncicira, nciciramu, ncicirati, nciciranu, ncicirai, ncicirasti, ncicirau, nciciràmuru, nciciràstivu, nciciràranu",OK
ncifuscari,Verbo,adirarsi,Italiano,"ncifuscu, ncifuscas, ncifusca, ncifuscamu, ncifuscati, ncifuscanu, ncifuscai, ncifuscasti, ncifuscau, ncifuscàmuru, ncifuscàstivu, ncifuscàranu",OK
ncignari,Verbo,"1. empezar, principiar, comenzar",Español,"ncignu, ncignas, ncigna, ncignamu, ncignati, ncignanu, ncignai, ncignasti, ncignau, ncignàmuru, ncignàstivu, ncignàranu",OK
ncilinnari,Verbo,dare il lustro alla tela,Italiano,"ncilinnu, ncilinnas, ncilinna, ncilinnamu, ncilinnati, ncilinnanu, ncilinnai, ncilinnasti, ncilinnau, ncilinnàmuru, ncilinnàstivu, ncilinnàranu",OK
ncipuddari,Verbo,adirarsi,Italiano,"ncipuddu, ncipuddas, ncipudda, ncipuddamu, ncipuddati, ncipuddanu, ncipuddai, ncipuddasti, ncipuddau, ncipuddàmuru, ncipuddàstivu, ncipuddàranu",OK
ncipuddusu,Verbo,un poco colérico,Español,,OK
ncirari,Verbo,encerar,Español,"nciru, nciras, ncira, nciramu, ncirati, nciranu, ncirai, ncirasti, ncirau, nciràmuru, nciràstivu, nciràranu",OK
ncircari,Verbo,cerchiare,Italiano,"ncircu, ncircas, ncirca, ncircamu, ncircati, ncircanu, ncircai, ncircasti, ncircau, ncircàmuru, ncircàstivu, ncircàranu",OK
ncirciddari,Verbo,accerchiare,Italiano,"ncirciddu, ncirciddas, ncircidda, ncirciddamu, ncirciddati, ncirciddanu, ncirciddai, ncirciddasti, ncirciddau, ncirciddàmuru, ncirciddàstivu, ncirciddàranu",OK
ncirrari,Verbo,cingere il corpo di busto,Italiano,"ncirru, ncirras, ncirra, ncirramu, ncirrati, ncirranu, ncirrai, ncirrasti, ncirrau, ncirràmuru, ncirràstivu, ncirràranu",OK
nciuscari,Verbo,ubriacarsi,Italiano,"nciuscu, nciuscas, nciusca, nciuscamu, nciuscati, nciuscanu, nciuscai, nciuscasti, nciuscau, nciuscàmuru, nciuscàstivu, nciuscàranu",OK
nclinari,Verbo,inclinar,Español,"nclinu, nclinas, nclina, nclinamu, nclinati, nclinanu, nclinai, nclinasti, nclinau, nclinàmuru, nclinàstivu, nclinàranu",OK
ncraculiri,Verbo,"intirizzire, intristire (detto di piante)",Italiano,"ncraculu, ncraculi, ncraculi, ncraculimu, ncraculiti, ncraculinu, ncraculii, ncraculisti, ncraculìu, ncraculìmuru, ncraculìstivu, ncraculìranu",OK
ncracuniri,Verbo,"intirizzire, intristire (detto di piante)",Italiano,"ncracunu, ncracuni, ncracuni, ncracunimu, ncracuniti, ncracuninu, ncracunii, ncracunisti, ncracunìu, ncracunìmuru, ncracunìstivu, ncracunìranu",OK
ncrafucchiari,Verbo,mettere in buca,Italiano,"ncrafucchiu, ncrafucchias, ncrafucchia, ncrafucchiamu, ncrafucchiati, ncrafucchianu, ncrafucchiai, ncrafucchiasti, ncrafucchiau, ncrafucchiàmuru, ncrafucchiàstivu, ncrafucchiàranu",OK
ncrasciatu,Verbo,sucio,Español,,OK
ncricchiari,Verbo,attorcigliarsi,Italiano,"ncricchiu, ncricchias, ncricchia, ncricchiamu, ncricchiati, ncricchianu, ncricchiai, ncricchiasti, ncricchiau, ncricchiàmuru, ncricchiàstivu, ncricchiàranu",OK
ncricchigghiari,Verbo,attorcigliarsi,Italiano,"ncricchigghiu, ncricchigghias, ncricchigghia, ncricchigghiamu, ncricchigghiati, ncricchigghianu, ncricchigghiai, ncricchigghiasti, ncricchigghiau, ncricchigghiàmuru, ncricchigghiàstivu, ncricchigghiàranu",OK
ncripari,Verbo,"stizzirsi, stizzire",Italiano,"ncripu, ncripas, ncripa, ncripamu, ncripati, ncripanu, ncripai, ncripasti, ncripau, ncripàmuru, ncripàstivu, ncripàranu",OK
ncripazzari,Verbo,fendersi,Italiano,"ncripazzu, ncripazzas, ncripazza, ncripazzamu, ncripazzati, ncripazzanu, ncripazzai, ncripazzasti, ncripazzau, ncripazzàmuru, ncripazzàstivu, ncripazzàranu",OK
ncripiddiri,Verbo,intirizzire,Italiano,"ncripiddu, ncripiddi, ncripiddi, ncripiddimu, ncripidditi, ncripiddinu, ncripiddii, ncripiddisti, ncripiddìu, ncripiddìmuru, ncripiddìstivu, ncripiddìranu",OK
ncrispatu,Verbo,plegado (que tiene arrugas),Español,,OK
ncruccari,Verbo,"uncinare, affibiare, appendere",Italiano,"ncruccu, ncruccas, ncrucca, ncruccamu, ncruccati, ncruccanu, ncruccai, ncruccasti, ncruccau, ncruccàmuru, ncruccàstivu, ncruccàranu",OK
ncrucchiamentu,Verbo,"capannello, riunione di gente",Italiano,,OK
ncrucchigghiari,Verbo,affibbiare,Italiano,"ncrucchigghiu, ncrucchigghias, ncrucchigghia, ncrucchigghiamu, ncrucchigghiati, ncrucchigghianu, ncrucchigghiai, ncrucchigghiasti, ncrucchigghiau, ncrucchigghiàmuru, ncrucchigghiàstivu, ncrucchigghiàranu",OK
ncrucchittari,Verbo,"1. affibbiare, allacciare con una fibbia, fermare, 2. affratellare",Italiano,"ncrucchittu, ncrucchittas, ncrucchitta, ncrucchittamu, ncrucchittati, ncrucchittanu, ncrucchittai, ncrucchittasti, ncrucchittau, ncrucchittàmuru, ncrucchittàstivu, ncrucchittàranu",OK
ncrucchiuliri,Verbo,indurire,Italiano,"ncrucchiulu, ncrucchiuli, ncrucchiuli, ncrucchiulimu, ncrucchiuliti, ncrucchiulinu, ncrucchiulii, ncrucchiulisti, ncrucchiulìu, ncrucchiulìmuru, ncrucchiulìstivu, ncrucchiulìranu",OK
ncruciari,Verbo,cruzar,Español,"ncruciu, ncrucias, ncrucia, ncruciamu, ncruciati, ncrucianu, ncruciai, ncruciasti, ncruciau, ncruciàmuru, ncruciàstivu, ncruciàranu",OK
ncrupari,Verbo,legare in maglia,Italiano,"ncrupu, ncrupas, ncrupa, ncrupamu, ncrupati, ncrupanu, ncrupai, ncrupasti, ncrupau, ncrupàmuru, ncrupàstivu, ncrupàranu",OK
ncucchiri,Verbo,sbalordire,Italiano,"ncucchu, ncucchi, ncucchi, ncucchimu, ncucchiti, ncucchinu, ncucchii, ncucchisti, ncucchìu, ncucchìmuru, ncucchìstivu, ncucchìranu",OK
ncucciari,Verbo,"agganciare, incocciarsi, attaccare",Italiano,"ncucciu, ncuccias, ncuccia, ncucciamu, ncucciati, ncuccianu, ncucciai, ncucciasti, ncucciau, ncucciàmuru, ncucciàstivu, ncucciàranu",OK
ncuculari,Verbo,accoccolare,Italiano,"ncuculu, ncuculas, ncucula, ncuculamu, ncuculati, ncuculanu, ncuculai, ncuculasti, ncuculau, ncuculàmuru, ncuculàstivu, ncuculàranu",OK
ncuffari,Verbo,mettere in sporta,Italiano,"ncuffu, ncuffas, ncuffa, ncuffamu, ncuffati, ncuffanu, ncuffai, ncuffasti, ncuffau, ncuffàmuru, ncuffàstivu, ncuffàranu",OK
ncufinari,Verbo,mettere in sporta,Italiano,"ncufinu, ncufinas, ncufina, ncufinamu, ncufinati, ncufinanu, ncufinai, ncufinasti, ncufinau, ncufinàmuru, ncufinàstivu, ncufinàranu",OK
ncufulari,Verbo,nascondersi in un buco,Italiano,"ncufulu, ncufulas, ncufula, ncufulamu, ncufulati, ncufulanu, ncufulai, ncufulasti, ncufulau, ncufulàmuru, ncufulàstivu, ncufulàranu",OK
ncufurunari,Verbo,starsene cruccioso per indisposizione o bizza,Italiano,"ncufurunu, ncufurunas, ncufuruna, ncufurunamu, ncufurunati, ncufurunanu, ncufurunai, ncufurunasti, ncufurunau, ncufurunàmuru, ncufurunàstivu, ncufurunàranu",OK
ncugnilari,Verbo,congelar,Español,"ncugnilu, ncugnilas, ncugnila, ncugnilamu, ncugnilati, ncugnilanu, ncugnilai, ncugnilasti, ncugnilau, ncugnilàmuru, ncugnilàstivu, ncugnilàranu",OK
ncuiri,Verbo,accostarsi,Italiano,"ncuu, ncui, ncui, ncuimu, ncuiti, ncuinu, ncuii, ncuisti, ncuìu, ncuìmuru, ncuìstivu, ncuìranu",OK
nculari,Verbo,"acquattarsi, rannicchiarsi",Italiano,"nculu, nculas, ncula, nculamu, nculati, nculanu, nculai, nculasti, nculau, nculàmuru, nculàstivu, nculàranu",OK
ncuminciari,Verbo,"comenzar, empezar",Español,"ncuminciu, ncumincias, ncumincia, ncuminciamu, ncuminciati, ncumincianu, ncuminciai, ncuminciasti, ncuminciau, ncuminciàmuru, ncuminciàstivu, ncuminciàranu",OK
ncuminzari,Verbo,"comenzar, empezar",Español,"ncuminzu, ncuminzas, ncuminza, ncuminzamu, ncuminzati, ncuminzanu, ncuminzai, ncuminzasti, ncuminzau, ncuminzàmuru, ncuminzàstivu, ncuminzàranu",OK
ncummintari,Verbo,"unire, attaccare",Italiano,"ncummintu, ncummintas, ncumminta, ncummintamu, ncummintati, ncummintanu, ncummintai, ncummintasti, ncummintau, ncummintàmuru, ncummintàstivu, ncummintàranu",OK
ncumpitenti,Verbo,incompetente,Español,,OK
ncunari,Verbo,disporre fichi secchi in modo da riprodurre una figura,Italiano,"ncunu, ncunas, ncuna, ncunamu, ncunati, ncunanu, ncunai, ncunasti, ncunau, ncunàmuru, ncunàstivu, ncunàranu",OK
ncunigghiari,Verbo,"rannicchiarsi per paura, intimidirsi",Italiano,"ncunigghiu, ncunigghias, ncunigghia, ncunigghiamu, ncunigghiati, ncunigghianu, ncunigghiai, ncunigghiasti, ncunigghiau, ncunigghiàmuru, ncunigghiàstivu, ncunigghiàranu",OK
ncunjilari,Verbo,congelar,Español,"ncunjilu, ncunjilas, ncunjila, ncunjilamu, ncunjilati, ncunjilanu, ncunjilai, ncunjilasti, ncunjilau, ncunjilàmuru, ncunjilàstivu, ncunjilàranu",OK
ncunnari,Verbo,acciabattare,Italiano,"ncunnu, ncunnas, ncunna, ncunnamu, ncunnati, ncunnanu, ncunnai, ncunnasti, ncunnau, ncunnàmuru, ncunnàstivu, ncunnàranu",OK
ncunnuttari,Verbo,nascondersi,Italiano,"ncunnuttu, ncunnuttas, ncunnutta, ncunnuttamu, ncunnuttati, ncunnuttanu, ncunnuttai, ncunnuttasti, ncunnuttau, ncunnuttàmuru, ncunnuttàstivu, ncunnuttàranu",OK
ncuntrari,Verbo,encontrar,Español,"ncuntru, ncuntras, ncuntra, ncuntramu, ncuntrati, ncuntranu, ncuntrai, ncuntrasti, ncuntrau, ncuntràmuru, ncuntràstivu, ncuntràranu",OK
ncurrivari,Verbo,intestardirsi,Italiano,"ncurrivu, ncurrivas, ncurriva, ncurrivamu, ncurrivati, ncurrivanu, ncurrivai, ncurrivasti, ncurrivau, ncurrivàmuru, ncurrivàstivu, ncurrivàranu",OK
ncusciari,Verbo,accosciarsi,Italiano,"ncusciu, ncuscias, ncuscia, ncusciamu, ncusciati, ncuscianu, ncusciai, ncusciasti, ncusciau, ncusciàmuru, ncusciàstivu, ncusciàranu",OK
ncustanari,Verbo,coprire il tetto con travicelli,Italiano,"ncustanu, ncustanas, ncustana, ncustanamu, ncustanati, ncustananu, ncustanai, ncustanasti, ncustanau, ncustanàmuru, ncustanàstivu, ncustanàranu",OK
ncutruniri,Verbo,"imbozzacchire, intristire, non attecchire, indurire",Italiano,"ncutrunu, ncutruni, ncutruni, ncutrunimu, ncutruniti, ncutruninu, ncutrunii, ncutrunisti, ncutrunìu, ncutrunìmuru, ncutrunìstivu, ncutrunìranu",OK
ncutufari,Verbo,rannicchiarsi,Italiano,"ncutufu, ncutufas, ncutufa, ncutufamu, ncutufati, ncutufanu, ncutufai, ncutufasti, ncutufau, ncutufàmuru, ncutufàstivu, ncutufàranu",OK
ncutugnari,Verbo,affliggere,Italiano,"ncutugnu, ncutugnas, ncutugna, ncutugnamu, ncutugnati, ncutugnanu, ncutugnai, ncutugnasti, ncutugnau, ncutugnàmuru, ncutugnàstivu, ncutugnàranu",OK
nfafucchiari,Verbo,"infinocchiare, impastocchiare, imbrogliare",Italiano,"nfafucchiu, nfafucchias, nfafucchia, nfafucchiamu, nfafucchiati, nfafucchianu, nfafucchiai, nfafucchiasti, nfafucchiau, nfafucchiàmuru, nfafucchiàstivu, nfafucchiàranu",OK
nfigghiulari,Verbo,fare strane mescolanze,Italiano,"nfigghiulu, nfigghiulas, nfigghiula, nfigghiulamu, nfigghiulati, nfigghiulanu, nfigghiulai, nfigghiulasti, nfigghiulau, nfigghiulàmuru, nfigghiulàstivu, nfigghiulàranu",OK
nfilari,Verbo,infilare,Italiano,"nfilu, nfilas, nfila, nfilamu, nfilati, nfilanu, nfilai, nfilasti, nfilau, nfilàmuru, nfilàstivu, nfilàranu",OK
nfinucchiari,Verbo,impastocchiare,Italiano,"nfinucchiu, nfinucchias, nfinucchia, nfinucchiamu, nfinucchiati, nfinucchianu, nfinucchiai, nfinucchiasti, nfinucchiau, nfinucchiàmuru, nfinucchiàstivu, nfinucchiàranu",OK
nfurmari,Verbo,informar,Español,"nfurmu, nfurmas, nfurma, nfurmamu, nfurmati, nfurmanu, nfurmai, nfurmasti, nfurmau, nfurmàmuru, nfurmàstivu, nfurmàranu",OK
nfurnatu,Verbo,horneado,Español,,OK
ngagghiuffari,Verbo,innamorarsi,Italiano,"ngagghiuffu, ngagghiuffas, ngagghiuffa, ngagghiuffamu, ngagghiuffati, ngagghiuffanu, ngagghiuffai, ngagghiuffasti, ngagghiuffau, ngagghiuffàmuru, ngagghiuffàstivu, ngagghiuffàranu",OK
ngaliciari,Verbo,vestirsi a lutto,Italiano,"ngaliciu, ngalicias, ngalicia, ngaliciamu, ngaliciati, ngalicianu, ngaliciai, ngaliciasti, ngaliciau, ngaliciàmuru, ngaliciàstivu, ngaliciàranu",OK
ngalimmari,Verbo,gonfiare e torcersi (detto del legno per umidità),Italiano,"ngalimmu, ngalimmas, ngalimma, ngalimmamu, ngalimmati, ngalimmanu, ngalimmai, ngalimmasti, ngalimmau, ngalimmàmuru, ngalimmàstivu, ngalimmàranu",OK
ngangittari,Verbo,agganciare,Italiano,"ngangittu, ngangittas, ngangitta, ngangittamu, ngangittati, ngangittanu, ngangittai, ngangittasti, ngangittau, ngangittàmuru, ngangittàstivu, ngangittàranu",OK
ngannari,Verbo,engañar,Español,"ngannu, ngannas, nganna, ngannamu, ngannati, ngannanu, ngannai, ngannasti, ngannau, ngannàmuru, ngannàstivu, ngannàranu",OK
ngarbizzari,Verbo,"avere a gusto, gradire",Italiano,"ngarbizzu, ngarbizzas, ngarbizza, ngarbizzamu, ngarbizzati, ngarbizzanu, ngarbizzai, ngarbizzasti, ngarbizzau, ngarbizzàmuru, ngarbizzàstivu, ngarbizzàranu",OK
ngarrari,Verbo,indovinare,Italiano,"ngarru, ngarras, ngarra, ngarramu, ngarrati, ngarranu, ngarrai, ngarrasti, ngarrau, ngarràmuru, ngarràstivu, ngarràranu",OK
ngastari,Verbo,"incastrare, incastonare",Italiano,"ngastu, ngastas, ngasta, ngastamu, ngastati, ngastanu, ngastai, ngastasti, ngastau, ngastàmuru, ngastàstivu, ngastàranu",OK
nghilari,Verbo,helar,Español,"nghilu, nghilas, nghila, nghilamu, nghilati, nghilanu, nghilai, nghilasti, nghilau, nghilàmuru, nghilàstivu, nghilàranu",OK
nghiùttiri,Verbo,tragar,Español,"nghiùttu, nghiùtti, nghiùtti, nghiùttimu, nghiùttiti, nghiùttinu, nghiùttii, nghiùttisti, nghiùttìu, nghiùttìmuru, nghiùttìstivu, nghiùttìranu",OK
nginucchiàrisi,Verbo,inginocchiarsi,Italiano,,OK
ngravattari,Verbo,battezzare un bambino nella maniera più semplice in pericolo di morte,Italiano,"ngravattu, ngravattas, ngravatta, ngravattamu, ngravattati, ngravattanu, ngravattai, ngravattasti, ngravattau, ngravattàmuru, ngravattàstivu, ngravattàranu",OK
ngrugnunari,Verbo,ammucchiare,Italiano,"ngrugnunu, ngrugnunas, ngrugnuna, ngrugnunamu, ngrugnunati, ngrugnunanu, ngrugnunai, ngrugnunasti, ngrugnunau, ngrugnunàmuru, ngrugnunàstivu, ngrugnunàranu",OK
nguainiri,Verbo,non penetrare nel petto (detto della punta della spada),Italiano,"nguainu, nguaini, nguaini, nguainimu, nguainiti, nguaininu, nguainii, nguainisti, nguainìu, nguainìmuru, nguainìstivu, nguainìranu",OK
ngudari,Verbo,"ristoppare, turare commessure",Italiano,"ngudu, ngudas, nguda, ngudamu, ngudati, ngudanu, ngudai, ngudasti, ngudau, ngudàmuru, ngudàstivu, ngudàranu",OK
ngummintari,Verbo,"unire, attaccare",Italiano,"ngummintu, ngummintas, ngumminta, ngummintamu, ngummintati, ngummintanu, ngummintai, ngummintasti, ngummintau, ngummintàmuru, ngummintàstivu, ngummintàranu",OK
nigari,Verbo,negar,Español,"nigu, nigas, niga, nigamu, nigati, niganu, nigai, nigasti, nigau, nigàmuru, nigàstivu, nigàranu",OK
niminagghia,Verbo,"adivinanza, acertijo",Español,,OK
nivicusu,Verbo,"nevoso, nevado",Español,,OK
nièsciri,Verbo,salir,Español,"nièscu, nièsci, nièsci, nièscimu, nièsciti, nièscinu, nièscii, nièscisti, nièscìu, nièscìmuru, nièscìstivu, nièscìranu",OK
njilari,Verbo,helar,Español,"njilu, njilas, njila, njilamu, njilati, njilanu, njilai, njilasti, njilau, njilàmuru, njilàstivu, njilàranu",OK
njittari,Verbo,"tirar, lanzar",Español,"njittu, njittas, njitta, njittamu, njittati, njittanu, njittai, njittasti, njittau, njittàmuru, njittàstivu, njittàranu",OK
nnacchiari,Verbo,canzonare,Italiano,"nnacchiu, nnacchias, nnacchia, nnacchiamu, nnacchiati, nnacchianu, nnacchiai, nnacchiasti, nnacchiau, nnacchiàmuru, nnacchiàstivu, nnacchiàranu",OK
nnamuratu,Verbo,enamorado,Español,,OK
nnamuràrisi,Verbo,enamorarse,Español,,OK
nnartari,Verbo,vantarsi,Italiano,"nnartu, nnartas, nnarta, nnartamu, nnartati, nnartanu, nnartai, nnartasti, nnartau, nnartàmuru, nnartàstivu, nnartàranu",OK
nniminagghia,Verbo,"adivinanza, acertijo",Español,,OK
nniminaglia,Verbo,"adivinanza, acertijo",Español,,OK
nnuminagghia,Verbo,"adivinanza, acertijo",Español,,OK
nquinquiari,Verbo,gorgheggiare,Italiano,"nquinquiu, nquinquias, nquinquia, nquinquiamu, nquinquiati, nquinquianu, nquinquiai, nquinquiasti, nquinquiau, nquinquiàmuru, nquinquiàstivu, nquinquiàranu",OK
nsalaniri,Verbo,"stordire, confondere, disorientare",Italiano,"nsalanu, nsalani, nsalani, nsalanimu, nsalaniti, nsalaninu, nsalanii, nsalanisti, nsalanìu, nsalanìmuru, nsalanìstivu, nsalanìranu",OK
nsancuniari,Verbo,sangrar,Español,"nsancuniu, nsancunias, nsancunia, nsancuniamu, nsancuniati, nsancunianu, nsancuniai, nsancuniasti, nsancuniau, nsancuniàmuru, nsancuniàstivu, nsancuniàranu",OK
nsanguliari,Verbo,bestemmiare,Italiano,"nsanguliu, nsangulias, nsangulia, nsanguliamu, nsanguliati, nsangulianu, nsanguliai, nsanguliasti, nsanguliau, nsanguliàmuru, nsanguliàstivu, nsanguliàranu",OK
nsanguniari,Verbo,sangrar,Español,"nsanguniu, nsangunias, nsangunia, nsanguniamu, nsanguniati, nsangunianu, nsanguniai, nsanguniasti, nsanguniau, nsanguniàmuru, nsanguniàstivu, nsanguniàranu",OK
nsarmunari,Verbo,legare,Italiano,"nsarmunu, nsarmunas, nsarmuna, nsarmunamu, nsarmunati, nsarmunanu, nsarmunai, nsarmunasti, nsarmunau, nsarmunàmuru, nsarmunàstivu, nsarmunàranu",OK
nsavacciari,Verbo,dare la marezzatura (conferire un aspetto striato),Italiano,"nsavacciu, nsavaccias, nsavaccia, nsavacciamu, nsavacciati, nsavaccianu, nsavacciai, nsavacciasti, nsavacciau, nsavacciàmuru, nsavacciàstivu, nsavacciàranu",OK
nsiddicari,Verbo,stimolare,Italiano,"nsiddicu, nsiddicas, nsiddica, nsiddicamu, nsiddicati, nsiddicanu, nsiddicai, nsiddicasti, nsiddicau, nsiddicàmuru, nsiddicàstivu, nsiddicàranu",OK
nsignari,Verbo,enseñar,Español,"nsignu, nsignas, nsigna, nsignamu, nsignati, nsignanu, nsignai, nsignasti, nsignau, nsignàmuru, nsignàstivu, nsignàranu",OK
nsignàrisi,Verbo,aprender,Español,,OK
nsirrattizzari,Verbo,fare l'impalcatura dei tetti,Italiano,"nsirrattizzu, nsirrattizzas, nsirrattizza, nsirrattizzamu, nsirrattizzati, nsirrattizzanu, nsirrattizzai, nsirrattizzasti, nsirrattizzau, nsirrattizzàmuru, nsirrattizzàstivu, nsirrattizzàranu",OK
nsitari,Verbo,"injertar, trasplantar",Español,"nsitu, nsitas, nsita, nsitamu, nsitati, nsitanu, nsitai, nsitasti, nsitau, nsitàmuru, nsitàstivu, nsitàranu",OK
nsultari,Verbo,insultar,Español,"nsultu, nsultas, nsulta, nsultamu, nsultati, nsultanu, nsultai, nsultasti, nsultau, nsultàmuru, nsultàstivu, nsultàranu",OK
nsunnari,Verbo,soñar,Español,"nsunnu, nsunnas, nsunna, nsunnamu, nsunnati, nsunnanu, nsunnai, nsunnasti, nsunnau, nsunnàmuru, nsunnàstivu, nsunnàranu",OK
nsunsari,Verbo,ensuciar,Español,"nsunsu, nsunsas, nsunsa, nsunsamu, nsunsati, nsunsanu, nsunsai, nsunsasti, nsunsau, nsunsàmuru, nsunsàstivu, nsunsàranu",OK
nsunsatu,Verbo,"lleno de grasa, sucio",Español,,OK
nsìddicu,Verbo,"cosquilleo, cosquillas",Español,,OK
nsìstiri,Verbo,insistir,Español,"nsìstu, nsìsti, nsìsti, nsìstimu, nsìstiti, nsìstinu, nsìstii, nsìstisti, nsìstìu, nsìstìmuru, nsìstìstivu, nsìstìranu",OK
ntabarrari,Verbo,"imbacuccarsi, ammantellarsi",Italiano,"ntabarru, ntabarras, ntabarra, ntabarramu, ntabarrati, ntabarranu, ntabarrai, ntabarrasti, ntabarrau, ntabarràmuru, ntabarràstivu, ntabarràranu",OK
ntabbaccari,Verbo,"tacersi, tacere",Italiano,"ntabbaccu, ntabbaccas, ntabbacca, ntabbaccamu, ntabbaccati, ntabbaccanu, ntabbaccai, ntabbaccasti, ntabbaccau, ntabbaccàmuru, ntabbaccàstivu, ntabbaccàranu",OK
ntabbanari,Verbo,mettere il gabbano,Italiano,"ntabbanu, ntabbanas, ntabbana, ntabbanamu, ntabbanati, ntabbananu, ntabbanai, ntabbanasti, ntabbanau, ntabbanàmuru, ntabbanàstivu, ntabbanàranu",OK
ntabbarrari,Verbo,"imbacuccarsi, ammantellarsi",Italiano,"ntabbarru, ntabbarras, ntabbarra, ntabbarramu, ntabbarrati, ntabbarranu, ntabbarrai, ntabbarrasti, ntabbarrau, ntabbarràmuru, ntabbarràstivu, ntabbarràranu",OK
ntamatu,Verbo,aturdido,Español,,OK
ntammarari,Verbo,"marinare, salare",Italiano,"ntammaru, ntammaras, ntammara, ntammaramu, ntammarati, ntammaranu, ntammarai, ntammarasti, ntammarau, ntammaràmuru, ntammaràstivu, ntammaràranu",OK
ntampanari,Verbo,istupidire,Italiano,"ntampanu, ntampanas, ntampana, ntampanamu, ntampanati, ntampananu, ntampanai, ntampanasti, ntampanau, ntampanàmuru, ntampanàstivu, ntampanàranu",OK
ntampasiri,Verbo,istupidire,Italiano,"ntampasu, ntampasi, ntampasi, ntampasimu, ntampasiti, ntampasinu, ntampasii, ntampasisti, ntampasìu, ntampasìmuru, ntampasìstivu, ntampasìranu",OK
ntampasuniri,Verbo,istupidire,Italiano,"ntampasunu, ntampasuni, ntampasuni, ntampasunimu, ntampasuniti, ntampasuninu, ntampasunii, ntampasunisti, ntampasunìu, ntampasunìmuru, ntampasunìstivu, ntampasunìranu",OK
ntantiddu,Verbo,tentatore,Italiano,,OK
ntantuliari,Verbo,"perder tempo, dondolarsela",Italiano,"ntantuliu, ntantulias, ntantulia, ntantuliamu, ntantuliati, ntantulianu, ntantuliai, ntantuliasti, ntantuliau, ntantuliàmuru, ntantuliàstivu, ntantuliàranu",OK
ntappari,Verbo,"obturar, tapar (cerrar)",Español,"ntappu, ntappas, ntappa, ntappamu, ntappati, ntappanu, ntappai, ntappasti, ntappau, ntappàmuru, ntappàstivu, ntappàranu",OK
ntarcari,Verbo,"1. prendere il lutto, 2. frodare in commercio, 3. maritar male una fanciulla",Italiano,"ntarcu, ntarcas, ntarca, ntarcamu, ntarcati, ntarcanu, ntarcai, ntarcasti, ntarcau, ntarcàmuru, ntarcàstivu, ntarcàranu",OK
ntarchiari,Verbo,"1. maritare male, 2. maritarsi male",Italiano,"ntarchiu, ntarchias, ntarchia, ntarchiamu, ntarchiati, ntarchianu, ntarchiai, ntarchiasti, ntarchiau, ntarchiàmuru, ntarchiàstivu, ntarchiàranu",OK
ntaviddari,Verbo,"1. fasciare con assicelle un osso fratturato, 2. fare le pieghe in un abito",Italiano,"ntaviddu, ntaviddas, ntavidda, ntaviddamu, ntaviddati, ntaviddanu, ntaviddai, ntaviddasti, ntaviddau, ntaviddàmuru, ntaviddàstivu, ntaviddàranu",OK
nticchiari,Verbo,"1. far presto, 2. salire, 3. mettere le frondi",Italiano,"nticchiu, nticchias, nticchia, nticchiamu, nticchiati, nticchianu, nticchiai, nticchiasti, nticchiau, nticchiàmuru, nticchiàstivu, nticchiàranu",OK
nticciari,Verbo,giocare battendo la monetina al muro,Italiano,"nticciu, nticcias, nticcia, nticciamu, nticciati, nticcianu, nticciai, nticciasti, nticciau, nticciàmuru, nticciàstivu, nticciàranu",OK
ntinguliari,Verbo,mangiar poco e svogliatamente,Italiano,"ntinguliu, ntingulias, ntingulia, ntinguliamu, ntinguliati, ntingulianu, ntinguliai, ntinguliasti, ntinguliau, ntinguliàmuru, ntinguliàstivu, ntinguliàranu",OK
ntinnari,Verbo,"girare velocemente, rotolarsi",Italiano,"ntinnu, ntinnas, ntinna, ntinnamu, ntinnati, ntinnanu, ntinnai, ntinnasti, ntinnau, ntinnàmuru, ntinnàstivu, ntinnàranu",OK
ntintiriddiri,Verbo,"incattivire, peggiorare nello stato di salute",Italiano,"ntintiriddu, ntintiriddi, ntintiriddi, ntintiriddimu, ntintiridditi, ntintiriddinu, ntintiriddii, ntintiriddisti, ntintiriddìu, ntintiriddìmuru, ntintiriddìstivu, ntintiriddìranu",OK
ntipari,Verbo,"1. premere su un punto, puntare, 2. dare batoste",Italiano,"ntipu, ntipas, ntipa, ntipamu, ntipati, ntipanu, ntipai, ntipasti, ntipau, ntipàmuru, ntipàstivu, ntipàranu",OK
ntipuddari,Verbo,dare botte (Sutera),Italiano,"ntipuddu, ntipuddas, ntipudda, ntipuddamu, ntipuddati, ntipuddanu, ntipuddai, ntipuddasti, ntipuddau, ntipuddàmuru, ntipuddàstivu, ntipuddàranu",OK
ntirissanti,Verbo,interesante,Español,,OK
ntirissatu,Verbo,interesado,Español,,OK
ntirpritari,Verbo,interpretare,Italiano,"ntirpritu, ntirpritas, ntirprita, ntirpritamu, ntirpritati, ntirpritanu, ntirpritai, ntirpritasti, ntirpritau, ntirpritàmuru, ntirpritàstivu, ntirpritàranu",OK
ntirrugari,Verbo,interrogar,Español,"ntirrugu, ntirrugas, ntirruga, ntirrugamu, ntirrugati, ntirruganu, ntirrugai, ntirrugasti, ntirrugau, ntirrugàmuru, ntirrugàstivu, ntirrugàranu",OK
ntrabbuniri,Verbo,"atardecer, anochecer / atardecer, puesta del Sol, anochecer, crepúsculo",Español,"ntrabbunu, ntrabbuni, ntrabbuni, ntrabbunimu, ntrabbuniti, ntrabbuninu, ntrabbunii, ntrabbunisti, ntrabbunìu, ntrabbunìmuru, ntrabbunìstivu, ntrabbunìranu",OK
ntrabuniri,Verbo,"atardecer, anochecer / atardecer, puesta del Sol, anochecer, crepúsculo",Español,"ntrabunu, ntrabuni, ntrabuni, ntrabunimu, ntrabuniti, ntrabuninu, ntrabunii, ntrabunisti, ntrabunìu, ntrabunìmuru, ntrabunìstivu, ntrabunìranu",OK
ntransitivu,Verbo,intransitivo,Español,,OK
ntranzitivu,Verbo,intransitivo,Español,,OK
ntrasattu,Verbo,"de improviso, de repente",Español,,OK
ntrimulari,Verbo,affogare nella melma,Italiano,"ntrimulu, ntrimulas, ntrimula, ntrimulamu, ntrimulati, ntrimulanu, ntrimulai, ntrimulasti, ntrimulau, ntrimulàmuru, ntrimulàstivu, ntrimulàranu",OK
ntrinzari,Verbo,tejer haciendo trenzas,Español,"ntrinzu, ntrinzas, ntrinza, ntrinzamu, ntrinzati, ntrinzanu, ntrinzai, ntrinzasti, ntrinzau, ntrinzàmuru, ntrinzàstivu, ntrinzàranu",OK
ntrizzari,Verbo,tejer haciendo trenzas,Español,"ntrizzu, ntrizzas, ntrizza, ntrizzamu, ntrizzati, ntrizzanu, ntrizzai, ntrizzasti, ntrizzau, ntrizzàmuru, ntrizzàstivu, ntrizzàranu",OK
